legit;alexa;newfoundsanderwordpresscom;newfoundsander.wordpress.com;n e w f o u n d s a n d e r w o r d p r e s s c o m;ne ew wf fo ou un nd ds sa an nd de er rw wo or rd dp pr re es ss sc co om;new ewf wfo fou oun und nds dsa san and nde der erw rwo wor ord rdp dpr pre res ess ssc sco com om
legit;alexa;humboldtschule-hgde;humboldtschule-hg.de;h u m b o l d t s c h u l e - h g d e;hu um mb bo ol ld dt ts sc ch hu ul le e- -h hg gd de;hum umb mbo bol old ldt dts tsc sch chu hul ule le- e-h -hg hgd gde de
legit;alexa;zoonderorgru;zoonder.org.ru;z o o n d e r o r g r u;zo oo on nd de er ro or rg gr ru;zoo oon ond nde der ero ror org rgr gru ru
legit;alexa;antiquariatocostacom;antiquariatocosta.com;a n t i q u a r i a t o c o s t a c o m;an nt ti iq qu ua ar ri ia at to oc co os st ta ac co om;ant nti tiq iqu qua uar ari ria iat ato toc oco cos ost sta tac aco com om
legit;alexa;stylepitdk;stylepit.dk;s t y l e p i t d k;st ty yl le ep pi it td dk;sty tyl yle lep epi pit itd tdk dk
legit;alexa;uyducanet;uyduca.net;u y d u c a n e t;uy yd du uc ca an ne et;uyd ydu duc uca can ane net et
legit;alexa;nice-ass-daytumblrcom;nice-ass-day.tumblr.com;n i c e - a s s - d a y t u m b l r c o m;ni ic ce e- -a as ss s- -d da ay yt tu um mb bl lr rc co om;nic ice ce- e-a -as ass ss- s-d -da day ayt ytu tum umb mbl blr lrc rco com om
legit;alexa;4366com;4366.com;4 3 6 6 c o m;43 36 66 6c co om;436 366 66c 6co com om
legit;alexa;askimkommuneno;askim.kommune.no;a s k i m k o m m u n e n o;as sk ki im mk ko om mm mu un ne en no;ask ski kim imk mko kom omm mmu mun une nen eno no
legit;alexa;geomorecom;geomore.com;g e o m o r e c o m;ge eo om mo or re ec co om;geo eom omo mor ore rec eco com om
legit;alexa;stjohnsknaphillcouk;stjohnsknaphill.co.uk;s t j o h n s k n a p h i l l c o u k;st tj jo oh hn ns sk kn na ap ph hi il ll lc co ou uk;stj tjo joh ohn hns nsk skn kna nap aph phi hil ill llc lco cou ouk uk
legit;alexa;modernatherapeuticssharepointcom;modernatherapeutics.sharepoint.com;m o d e r n a t h e r a p e u t i c s s h a r e p o i n t c o m;mo od de er rn na at th he er ra ap pe eu ut ti ic cs ss sh ha ar re ep po oi in nt tc co om;mod ode der ern rna nat ath the her era rap ape peu eut uti tic ics css ssh sha har are rep epo poi oin int ntc tco com om
legit;alexa;delinatcom;delinat.com;d e l i n a t c o m;de el li in na at tc co om;del eli lin ina nat atc tco com om
legit;alexa;nuitduhackcom;nuitduhack.com;n u i t d u h a c k c o m;nu ui it td du uh ha ac ck kc co om;nui uit itd tdu duh uha hac ack ckc kco com om
legit;alexa;sel4maorg;sel4ma.org;s e l 4 m a o r g;se el l4 4m ma ao or rg;sel el4 l4m 4ma mao aor org rg
legit;alexa;rzjetsnet;rzjets.net;r z j e t s n e t;rz zj je et ts sn ne et;rzj zje jet ets tsn sne net et
legit;alexa;bobverescom;bobveres.com;b o b v e r e s c o m;bo ob bv ve er re es sc co om;bob obv bve ver ere res esc sco com om
legit;alexa;risfaxcojp;risfax.co.jp;r i s f a x c o j p;ri is sf fa ax xc co oj jp;ris isf sfa fax axc xco coj ojp jp
legit;alexa;nzliiorg;nzlii.org;n z l i i o r g;nz zl li ii io or rg;nzl zli lii iio ior org rg
legit;alexa;typosthesgr;typosthes.gr;t y p o s t h e s g r;ty yp po os st th he es sg gr;typ ypo pos ost sth the hes esg sgr gr
legit;alexa;usitripcom;usitrip.com;u s i t r i p c o m;us si it tr ri ip pc co om;usi sit itr tri rip ipc pco com om
legit;alexa;krasnoeozeroru;krasnoeozero.ru;k r a s n o e o z e r o r u;kr ra as sn no oe eo oz ze er ro or ru;kra ras asn sno noe oeo eoz oze zer ero ror oru ru
legit;alexa;manaoeu;manao.eu;m a n a o e u;ma an na ao oe eu;man ana nao aoe oeu eu
legit;alexa;americansweetscouk;americansweets.co.uk;a m e r i c a n s w e e t s c o u k;am me er ri ic ca an ns sw we ee et ts sc co ou uk;ame mer eri ric ica can ans nsw swe wee eet ets tsc sco cou ouk uk
legit;alexa;91dizhispace;91dizhi.space;9 1 d i z h i s p a c e;91 1d di iz zh hi is sp pa ac ce;91d 1di diz izh zhi his isp spa pac ace ce
legit;alexa;piczoolcom;piczool.com;p i c z o o l c o m;pi ic cz zo oo ol lc co om;pic icz czo zoo ool olc lco com om
legit;alexa;trabalheseusonhocombr;trabalheseusonho.com.br;t r a b a l h e s e u s o n h o c o m b r;tr ra ab ba al lh he es se eu us so on nh ho oc co om mb br;tra rab aba bal alh lhe hes ese seu eus uso son onh nho hoc oco com omb mbr br
legit;alexa;audiodeluxecom;audiodeluxe.com;a u d i o d e l u x e c o m;au ud di io od de el lu ux xe ec co om;aud udi dio iod ode del elu lux uxe xec eco com om
legit;alexa;nero123456tumblrcom;nero123456.tumblr.com;n e r o 1 2 3 4 5 6 t u m b l r c o m;ne er ro o1 12 23 34 45 56 6t tu um mb bl lr rc co om;ner ero ro1 o12 123 234 345 456 56t 6tu tum umb mbl blr lrc rco com om
legit;alexa;gradeus;grade.us;g r a d e u s;gr ra ad de eu us;gra rad ade deu eus us
legit;alexa;jonathan-cooknet;jonathan-cook.net;j o n a t h a n - c o o k n e t;jo on na at th ha an n- -c co oo ok kn ne et;jon ona nat ath tha han an- n-c -co coo ook okn kne net et
legit;alexa;pishro-rayaneir;pishro-rayane.ir;p i s h r o - r a y a n e i r;pi is sh hr ro o- -r ra ay ya an ne ei ir;pis ish shr hro ro- o-r -ra ray aya yan ane nei eir ir
legit;alexa;groomershoppl;groomershop.pl;g r o o m e r s h o p p l;gr ro oo om me er rs sh ho op pp pl;gro roo oom ome mer ers rsh sho hop opp ppl pl
legit;alexa;trannyfreefuckcom;trannyfreefuck.com;t r a n n y f r e e f u c k c o m;tr ra an nn ny yf fr re ee ef fu uc ck kc co om;tra ran ann nny nyf yfr fre ree eef efu fuc uck ckc kco com om
legit;alexa;bayernstreamcom;bayernstream.com;b a y e r n s t r e a m c o m;ba ay ye er rn ns st tr re ea am mc co om;bay aye yer ern rns nst str tre rea eam amc mco com om
legit;alexa;skicbcom;skicb.com;s k i c b c o m;sk ki ic cb bc co om;ski kic icb cbc bco com om
legit;alexa;customelementsio;customelements.io;c u s t o m e l e m e n t s i o;cu us st to om me el le em me en nt ts si io;cus ust sto tom ome mel ele lem eme men ent nts tsi sio io
legit;alexa;hexinbbsblog163com;hexinbbs.blog.163.com;h e x i n b b s b l o g 1 6 3 c o m;he ex xi in nb bb bs sb bl lo og g1 16 63 3c co om;hex exi xin inb nbb bbs bsb sbl blo log og1 g16 163 63c 3co com om
legit;alexa;internetspeedradarcom;internetspeedradar.com;i n t e r n e t s p e e d r a d a r c o m;in nt te er rn ne et ts sp pe ee ed dr ra ad da ar rc co om;int nte ter ern rne net ets tsp spe pee eed edr dra rad ada dar arc rco com om
legit;alexa;punkcasecom;punkcase.com;p u n k c a s e c o m;pu un nk kc ca as se ec co om;pun unk nkc kca cas ase sec eco com om
legit;alexa;dalvenvainorcom;dalvenvainor.com;d a l v e n v a i n o r c o m;da al lv ve en nv va ai in no or rc co om;dal alv lve ven env nva vai ain ino nor orc rco com om
legit;alexa;teslaconcursoscombr;teslaconcursos.com.br;t e s l a c o n c u r s o s c o m b r;te es sl la ac co on nc cu ur rs so os sc co om mb br;tes esl sla lac aco con onc ncu cur urs rso sos osc sco com omb mbr br
legit;alexa;networkmarketing-magazinde;networkmarketing-magazin.de;n e t w o r k m a r k e t i n g - m a g a z i n d e;ne et tw wo or rk km ma ar rk ke et ti in ng g- -m ma ag ga az zi in nd de;net etw two wor ork rkm kma mar ark rke ket eti tin ing ng- g-m -ma mag aga gaz azi zin ind nde de
legit;alexa;secure-xchangecom;secure-xchange.com;s e c u r e - x c h a n g e c o m;se ec cu ur re e- -x xc ch ha an ng ge ec co om;sec ecu cur ure re- e-x -xc xch cha han ang nge gec eco com om
legit;alexa;kinozallnet;kinozall.net;k i n o z a l l n e t;ki in no oz za al ll ln ne et;kin ino noz oza zal all lln lne net et
legit;alexa;wirtschaftspresseagenturcom;wirtschaftspresseagentur.com;w i r t s c h a f t s p r e s s e a g e n t u r c o m;wi ir rt ts sc ch ha af ft ts sp pr re es ss se ea ag ge en nt tu ur rc co om;wir irt rts tsc sch cha haf aft fts tsp spr pre res ess sse sea eag age gen ent ntu tur urc rco com om
legit;alexa;mdc888jp;mdc888.jp;m d c 8 8 8 j p;md dc c8 88 88 8j jp;mdc dc8 c88 888 88j 8jp jp
legit;alexa;ilistcomtw;ilist.com.tw;i l i s t c o m t w;il li is st tc co om mt tw;ili lis ist stc tco com omt mtw tw
legit;alexa;porqueseguirajesuswordpresscom;porqueseguirajesus.wordpress.com;p o r q u e s e g u i r a j e s u s w o r d p r e s s c o m;po or rq qu ue es se eg gu ui ir ra aj je es su us sw wo or rd dp pr re es ss sc co om;por orq rqu que ues ese seg egu gui uir ira raj aje jes esu sus usw swo wor ord rdp dpr pre res ess ssc sco com om
legit;alexa;rakacreativecom;rakacreative.com;r a k a c r e a t i v e c o m;ra ak ka ac cr re ea at ti iv ve ec co om;rak aka kac acr cre rea eat ati tiv ive vec eco com om
legit;alexa;hotelstormcom;hotelstorm.com;h o t e l s t o r m c o m;ho ot te el ls st to or rm mc co om;hot ote tel els lst sto tor orm rmc mco com om
legit;alexa;perfectionhd30net;perfectionhd30.net;p e r f e c t i o n h d 3 0 n e t;pe er rf fe ec ct ti io on nh hd d3 30 0n ne et;per erf rfe fec ect cti tio ion onh nhd hd3 d30 30n 0ne net et
legit;alexa;intime01co;intime01.co;i n t i m e 0 1 c o;in nt ti im me e0 01 1c co;int nti tim ime me0 e01 01c 1co co
legit;alexa;cta-perceptioncom;cta-perception.com;c t a - p e r c e p t i o n c o m;ct ta a- -p pe er rc ce ep pt ti io on nc co om;cta ta- a-p -pe per erc rce cep ept pti tio ion onc nco com om
legit;alexa;vfbhermsdorfde;vfbhermsdorf.de;v f b h e r m s d o r f d e;vf fb bh he er rm ms sd do or rf fd de;vfb fbh bhe her erm rms msd sdo dor orf rfd fde de
legit;alexa;newsilikein;newsilike.in;n e w s i l i k e i n;ne ew ws si il li ik ke ei in;new ews wsi sil ili lik ike kei ein in
legit;alexa;jonglerkacom;jonglerka.com;j o n g l e r k a c o m;jo on ng gl le er rk ka ac co om;jon ong ngl gle ler erk rka kac aco com om
legit;alexa;tolexocom;tolexo.com;t o l e x o c o m;to ol le ex xo oc co om;tol ole lex exo xoc oco com om
legit;alexa;ucorelcom;ucorel.com;u c o r e l c o m;uc co or re el lc co om;uco cor ore rel elc lco com om
legit;alexa;esmemmcom;esmemm.com;e s m e m m c o m;es sm me em mm mc co om;esm sme mem emm mmc mco com om
legit;alexa;euvisionseu;euvisions.eu;e u v i s i o n s e u;eu uv vi is si io on ns se eu;euv uvi vis isi sio ion ons nse seu eu
legit;alexa;pacokhblogskycom;pacokh.blogsky.com;p a c o k h b l o g s k y c o m;pa ac co ok kh hb bl lo og gs sk ky yc co om;pac aco cok okh khb hbl blo log ogs gsk sky kyc yco com om
legit;alexa;fc2cncom;fc2cn.com;f c 2 c n c o m;fc c2 2c cn nc co om;fc2 c2c 2cn cnc nco com om
legit;alexa;besaao;besa.ao;b e s a a o;be es sa aa ao;bes esa saa aao ao
legit;alexa;ingesaezcom;ingesaez.com;i n g e s a e z c o m;in ng ge es sa ae ez zc co om;ing nge ges esa sae aez ezc zco com om
legit;alexa;theafricancourierde;theafricancourier.de;t h e a f r i c a n c o u r i e r d e;th he ea af fr ri ic ca an nc co ou ur ri ie er rd de;the hea eaf afr fri ric ica can anc nco cou our uri rie ier erd rde de
legit;alexa;real-net11-learningcom;real-net11-learning.com;r e a l - n e t 1 1 - l e a r n i n g c o m;re ea al l- -n ne et t1 11 1- -l le ea ar rn ni in ng gc co om;rea eal al- l-n -ne net et1 t11 11- 1-l -le lea ear arn rni nin ing ngc gco com om
legit;alexa;synectics-germanyde;synectics-germany.de;s y n e c t i c s - g e r m a n y d e;sy yn ne ec ct ti ic cs s- -g ge er rm ma an ny yd de;syn yne nec ect cti tic ics cs- s-g -ge ger erm rma man any nyd yde de
legit;alexa;allianzworldwidepartnerscomau;allianzworldwidepartners.com.au;a l l i a n z w o r l d w i d e p a r t n e r s c o m a u;al ll li ia an nz zw wo or rl ld dw wi id de ep pa ar rt tn ne er rs sc co om ma au;all lli lia ian anz nzw zwo wor orl rld ldw dwi wid ide dep epa par art rtn tne ner ers rsc sco com oma mau au
legit;alexa;photodoskaru;photodoska.ru;p h o t o d o s k a r u;ph ho ot to od do os sk ka ar ru;pho hot oto tod odo dos osk ska kar aru ru
legit;alexa;yourgreatestversioncom;yourgreatestversion.com;y o u r g r e a t e s t v e r s i o n c o m;yo ou ur rg gr re ea at te es st tv ve er rs si io on nc co om;you our urg rgr gre rea eat ate tes est stv tve ver ers rsi sio ion onc nco com om
legit;alexa;kraeuter-buchde;kraeuter-buch.de;k r a e u t e r - b u c h d e;kr ra ae eu ut te er r- -b bu uc ch hd de;kra rae aeu eut ute ter er- r-b -bu buc uch chd hde de
legit;alexa;creditsystemcom;creditsystem.com;c r e d i t s y s t e m c o m;cr re ed di it ts sy ys st te em mc co om;cre red edi dit its tsy sys yst ste tem emc mco com om
legit;alexa;nigeriamedjcom;nigeriamedj.com;n i g e r i a m e d j c o m;ni ig ge er ri ia am me ed dj jc co om;nig ige ger eri ria iam ame med edj djc jco com om
legit;alexa;labicardcom;labicard.com;l a b i c a r d c o m;la ab bi ic ca ar rd dc co om;lab abi bic ica car ard rdc dco com om
legit;alexa;vknamillioncom;vknamillion.com;v k n a m i l l i o n c o m;vk kn na am mi il ll li io on nc co om;vkn kna nam ami mil ill lli lio ion onc nco com om
legit;alexa;shop-keyboardscouk;shop-keyboards.co.uk;s h o p - k e y b o a r d s c o u k;sh ho op p- -k ke ey yb bo oa ar rd ds sc co ou uk;sho hop op- p-k -ke key eyb ybo boa oar ard rds dsc sco cou ouk uk
legit;alexa;walkscom;walks.com;w a l k s c o m;wa al lk ks sc co om;wal alk lks ksc sco com om
legit;alexa;shopinteriocom;shopinterio.com;s h o p i n t e r i o c o m;sh ho op pi in nt te er ri io oc co om;sho hop opi pin int nte ter eri rio ioc oco com om
legit;alexa;ihavebooknet;ihavebook.net;i h a v e b o o k n e t;ih ha av ve eb bo oo ok kn ne et;iha hav ave veb ebo boo ook okn kne net et
legit;alexa;game-showgr;game-show.gr;g a m e - s h o w g r;ga am me e- -s sh ho ow wg gr;gam ame me- e-s -sh sho how owg wgr gr
legit;alexa;fddesignse;fddesign.se;f d d e s i g n s e;fd dd de es si ig gn ns se;fdd dde des esi sig ign gns nse se
legit;alexa;ekskurziabg;ekskurzia.bg;e k s k u r z i a b g;ek ks sk ku ur rz zi ia ab bg;eks ksk sku kur urz rzi zia iab abg bg
legit;alexa;yullvoverniceonline;yullvovernice.online;y u l l v o v e r n i c e o n l i n e;yu ul ll lv vo ov ve er rn ni ic ce eo on nl li in ne;yul ull llv lvo vov ove ver ern rni nic ice ceo eon onl nli lin ine ne
legit;alexa;jennifercodyspace;jennifercody.space;j e n n i f e r c o d y s p a c e;je en nn ni if fe er rc co od dy ys sp pa ac ce;jen enn nni nif ife fer erc rco cod ody dys ysp spa pac ace ce
legit;alexa;zapnitocom;zapnito.com;z a p n i t o c o m;za ap pn ni it to oc co om;zap apn pni nit ito toc oco com om
legit;alexa;islamsejatiorg;islamsejati.org;i s l a m s e j a t i o r g;is sl la am ms se ej ja at ti io or rg;isl sla lam ams mse sej eja jat ati tio ior org rg
legit;alexa;blutspendede;blutspende.de;b l u t s p e n d e d e;bl lu ut ts sp pe en nd de ed de;blu lut uts tsp spe pen end nde ded ede de
legit;alexa;fireartstudio;fireart.studio;f i r e a r t s t u d i o;fi ir re ea ar rt ts st tu ud di io;fir ire rea ear art rts tst stu tud udi dio io
legit;alexa;ar4porncom;ar4porn.com;a r 4 p o r n c o m;ar r4 4p po or rn nc co om;ar4 r4p 4po por orn rnc nco com om
legit;alexa;botdaulamdepcom;botdaulamdep.com;b o t d a u l a m d e p c o m;bo ot td da au ul la am md de ep pc co om;bot otd tda dau aul ula lam amd mde dep epc pco com om
legit;alexa;doublersimdifcom;doubler.simdif.com;d o u b l e r s i m d i f c o m;do ou ub bl le er rs si im md di if fc co om;dou oub ubl ble ler ers rsi sim imd mdi dif ifc fco com om
legit;alexa;timezoneconvertercom;timezoneconverter.com;t i m e z o n e c o n v e r t e r c o m;ti im me ez zo on ne ec co on nv ve er rt te er rc co om;tim ime mez ezo zon one nec eco con onv nve ver ert rte ter erc rco com om
legit;alexa;tele-gratuitnet;tele-gratuit.net;t e l e - g r a t u i t n e t;te el le e- -g gr ra at tu ui it tn ne et;tel ele le- e-g -gr gra rat atu tui uit itn tne net et
legit;alexa;ar-jobscouk;ar-jobs.co.uk;a r - j o b s c o u k;ar r- -j jo ob bs sc co ou uk;ar- r-j -jo job obs bsc sco cou ouk uk
legit;alexa;palabrasconcom;palabrascon.com;p a l a b r a s c o n c o m;pa al la ab br ra as sc co on nc co om;pal ala lab abr bra ras asc sco con onc nco com om
legit;alexa;diggpediacom;diggpedia.com;d i g g p e d i a c o m;di ig gg gp pe ed di ia ac co om;dig igg ggp gpe ped edi dia iac aco com om
legit;alexa;mrallenswikispacescom;mrallens.wikispaces.com;m r a l l e n s w i k i s p a c e s c o m;mr ra al ll le en ns sw wi ik ki is sp pa ac ce es sc co om;mra ral all lle len ens nsw swi wik iki kis isp spa pac ace ces esc sco com om
legit;alexa;kampanyavadisicom;kampanyavadisi.com;k a m p a n y a v a d i s i c o m;ka am mp pa an ny ya av va ad di is si ic co om;kam amp mpa pan any nya yav ava vad adi dis isi sic ico com om
legit;alexa;digischoolsir;digischools.ir;d i g i s c h o o l s i r;di ig gi is sc ch ho oo ol ls si ir;dig igi gis isc sch cho hoo ool ols lsi sir ir
dga;gozi;mortiscontrastatimcom;mortiscontrastatim.com;m o r t i s c o n t r a s t a t i m c o m;mo or rt ti is sc co on nt tr ra as st ta at ti im mc co om;mor ort rti tis isc sco con ont ntr tra ras ast sta tat ati tim imc mco com om
dga;corebot;cvyh1po636avyrsxebwbkn7ddnsnet;cvyh1po636avyrsxebwbkn7.ddns.net;c v y h 1 p o 6 3 6 a v y r s x e b w b k n 7 d d n s n e t;cv vy yh h1 1p po o6 63 36 6a av vy yr rs sx xe eb bw wb bk kn n7 7d dd dn ns sn ne et;cvy vyh yh1 h1p 1po po6 o63 636 36a 6av avy vyr yrs rsx sxe xeb ebw bwb wbk bkn kn7 n7d 7dd ddn dns nsn sne net et
dga;ranbyus;txumyqrubwutbbcc;txumyqrubwutbb.cc;t x u m y q r u b w u t b b c c;tx xu um my yq qr ru ub bw wu ut tb bb bc cc;txu xum umy myq yqr qru rub ubw bwu wut utb tbb bbc bcc cc
dga;symmi;ixekrihagimauddnsnet;ixekrihagimau.ddns.net;i x e k r i h a g i m a u d d n s n e t;ix xe ek kr ri ih ha ag gi im ma au ud dd dn ns sn ne et;ixe xek ekr kri rih iha hag agi gim ima mau aud udd ddn dns nsn sne net et
dga;emotet;rjyuosmhfnaedlygeu;rjyuosmhfnaedlyg.eu;r j y u o s m h f n a e d l y g e u;rj jy yu uo os sm mh hf fn na ae ed dl ly yg ge eu;rjy jyu yuo uos osm smh mhf hfn fna nae aed edl dly lyg yge geu eu
dga;dircrypt;djqrmauttlloabjcom;djqrmauttlloabj.com;d j q r m a u t t l l o a b j c o m;dj jq qr rm ma au ut tt tl ll lo oa ab bj jc co om;djq jqr qrm rma mau aut utt ttl tll llo loa oab abj bjc jco com om
dga;ranbyus;tqbmiuywoywolsfevcom;tqbmiuywoywolsfev.com;t q b m i u y w o y w o l s f e v c o m;tq qb bm mi iu uy yw wo oy yw wo ol ls sf fe ev vc co om;tqb qbm bmi miu iuy uyw ywo woy oyw ywo wol ols lsf sfe fev evc vco com om
dga;matsnu;brothernerveplacebringconsultcom;brothernerveplacebringconsult.com;b r o t h e r n e r v e p l a c e b r i n g c o n s u l t c o m;br ro ot th he er rn ne er rv ve ep pl la ac ce eb br ri in ng gc co on ns su ul lt tc co om;bro rot oth the her ern rne ner erv rve vep epl pla lac ace ceb ebr bri rin ing ngc gco con ons nsu sul ult ltc tco com om
dga;ranbyus;lrushteeoideiqbcipw;lrushteeoideiqbci.pw;l r u s h t e e o i d e i q b c i p w;lr ru us sh ht te ee eo oi id de ei iq qb bc ci ip pw;lru rus ush sht hte tee eeo eoi oid ide dei eiq iqb qbc bci cip ipw pw
dga;simda;rycoquqawyweu;rycoquqawyw.eu;r y c o q u q a w y w e u;ry yc co oq qu uq qa aw wy yw we eu;ryc yco coq oqu quq uqa qaw awy wyw ywe weu eu
dga;fobber;cdjimfjspmcom;cdjimfjspm.com;c d j i m f j s p m c o m;cd dj ji im mf fj js sp pm mc co om;cdj dji jim imf mfj fjs jsp spm pmc mco com om
dga;pushdo;gasozjomru;gasozjom.ru;g a s o z j o m r u;ga as so oz zj jo om mr ru;gas aso soz ozj zjo jom omr mru ru
dga;pushdo;dokbuxokru;dokbuxok.ru;d o k b u x o k r u;do ok kb bu ux xo ok kr ru;dok okb kbu bux uxo xok okr kru ru
dga;qadars;w2oagqg2cmwiorg;w2oagqg2cmwi.org;w 2 o a g q g 2 c m w i o r g;w2 2o oa ag gq qg g2 2c cm mw wi io or rg;w2o 2oa oag agq gqg qg2 g2c 2cm cmw mwi wio ior org rg
dga;ranbyus;pxayfojidfskmlaqonet;pxayfojidfskmlaqo.net;p x a y f o j i d f s k m l a q o n e t;px xa ay yf fo oj ji id df fs sk km ml la aq qo on ne et;pxa xay ayf yfo foj oji jid idf dfs fsk skm kml mla laq aqo qon one net et
dga;emotet;jhhokenniuywfnmmeu;jhhokenniuywfnmm.eu;j h h o k e n n i u y w f n m m e u;jh hh ho ok ke en nn ni iu uy yw wf fn nm mm me eu;jhh hho hok oke ken enn nni niu iuy uyw ywf wfn fnm nmm mme meu eu
dga;matsnu;screencatchdishtellproposedcom;screencatchdishtellproposed.com;s c r e e n c a t c h d i s h t e l l p r o p o s e d c o m;sc cr re ee en nc ca at tc ch hd di is sh ht te el ll lp pr ro op po os se ed dc co om;scr cre ree een enc nca cat atc tch chd hdi dis ish sht hte tel ell llp lpr pro rop opo pos ose sed edc dco com om
dga;kraken;bqlqscpqwshdynservcom;bqlqscpqwsh.dynserv.com;b q l q s c p q w s h d y n s e r v c o m;bq ql lq qs sc cp pq qw ws sh hd dy yn ns se er rv vc co om;bql qlq lqs qsc scp cpq pqw qws wsh shd hdy dyn yns nse ser erv rvc vco com om
dga;matsnu;balladoptwelladdinfluencecom;balladoptwelladdinfluence.com;b a l l a d o p t w e l l a d d i n f l u e n c e c o m;ba al ll la ad do op pt tw we el ll la ad dd di in nf fl lu ue en nc ce ec co om;bal all lla lad ado dop opt ptw twe wel ell lla lad add ddi din inf nfl flu lue uen enc nce cec eco com om
dga;ramnit;vrnixstxftvpfocom;vrnixstxftvpfo.com;v r n i x s t x f t v p f o c o m;vr rn ni ix xs st tx xf ft tv vp pf fo oc co om;vrn rni nix ixs xst stx txf xft ftv tvp vpf pfo foc oco com om
dga;nymaim;searched-cookienet;searched-cookie.net;s e a r c h e d - c o o k i e n e t;se ea ar rc ch he ed d- -c co oo ok ki ie en ne et;sea ear arc rch che hed ed- d-c -co coo ook oki kie ien ene net et
dga;symmi;eqsaadnusddnsnet;eqsaadnus.ddns.net;e q s a a d n u s d d n s n e t;eq qs sa aa ad dn nu us sd dd dn ns sn ne et;eqs qsa saa aad adn dnu nus usd sdd ddn dns nsn sne net et
dga;nymaim;until-infantps;until-infant.ps;u n t i l - i n f a n t p s;un nt ti il l- -i in nf fa an nt tp ps;unt nti til il- l-i -in inf nfa fan ant ntp tps ps
dga;pykspa;guzcwufqbexorg;guzcwufqbex.org;g u z c w u f q b e x o r g;gu uz zc cw wu uf fq qb be ex xo or rg;guz uzc zcw cwu wuf ufq fqb qbe bex exo xor org rg
dga;kraken;svneascvmkmooocom;svneascvmk.mooo.com;s v n e a s c v m k m o o o c o m;sv vn ne ea as sc cv vm mk km mo oo oo oc co om;svn vne nea eas asc scv cvm vmk mkm kmo moo ooo ooc oco com om
dga;nymaim;woundfingerws;woundfinger.ws;w o u n d f i n g e r w s;wo ou un nd df fi in ng ge er rw ws;wou oun und ndf dfi fin ing nge ger erw rws ws
dga;tinba;mmggpwhxumpkbiz;mmggpwhxumpk.biz;m m g g p w h x u m p k b i z;mm mg gg gp pw wh hx xu um mp pk kb bi iz;mmg mgg ggp gpw pwh whx hxu xum ump mpk pkb kbi biz iz
dga;murofet;pksnprwyupqtsiinet;pksnprwyupqtsii.net;p k s n p r w y u p q t s i i n e t;pk ks sn np pr rw wy yu up pq qt ts si ii in ne et;pks ksn snp npr prw rwy wyu yup upq pqt qts tsi sii iin ine net et
dga;pushdo;dikeabokru;dikeabok.ru;d i k e a b o k r u;di ik ke ea ab bo ok kr ru;dik ike kea eab abo bok okr kru ru
dga;fobber;skxxerflmwcom;skxxerflmw.com;s k x x e r f l m w c o m;sk kx xx xe er rf fl lm mw wc co om;skx kxx xxe xer erf rfl flm lmw mwc wco com om
dga;qadars;kycmwawegm46top;kycmwawegm46.top;k y c m w a w e g m 4 6 t o p;ky yc cm mw wa aw we eg gm m4 46 6t to op;kyc ycm cmw mwa waw awe weg egm gm4 m46 46t 6to top op
dga;cryptolocker;xmambdaytivttbiz;xmambdaytivtt.biz;x m a m b d a y t i v t t b i z;xm ma am mb bd da ay yt ti iv vt tt tb bi iz;xma mam amb mbd bda day ayt yti tiv ivt vtt ttb tbi biz iz
dga;nymaim;slut-fanssh;slut-fans.sh;s l u t - f a n s s h;sl lu ut t- -f fa an ns ss sh;slu lut ut- t-f -fa fan ans nss ssh sh
dga;ramdo;qkgogwauessomcqaorg;qkgogwauessomcqa.org;q k g o g w a u e s s o m c q a o r g;qk kg go og gw wa au ue es ss so om mc cq qa ao or rg;qkg kgo gog ogw gwa wau aue ues ess sso som omc mcq cqa qao aor org rg
dga;nymaim;vicehughespro;vicehughes.pro;v i c e h u g h e s p r o;vi ic ce eh hu ug gh he es sp pr ro;vic ice ceh ehu hug ugh ghe hes esp spr pro ro
dga;symmi;odxaecfeuddecesddnsnet;odxaecfeuddeces.ddns.net;o d x a e c f e u d d e c e s d d n s n e t;od dx xa ae ec cf fe eu ud dd de ec ce es sd dd dn ns sn ne et;odx dxa xae aec ecf cfe feu eud udd dde dec ece ces esd sdd ddn dns nsn sne net et
dga;vawtrak;usecwemsercom;usecwemser.com;u s e c w e m s e r c o m;us se ec cw we em ms se er rc co om;use sec ecw cwe wem ems mse ser erc rco com om
dga;fobber;qqplezdjxvcom;qqplezdjxv.com;q q p l e z d j x v c o m;qq qp pl le ez zd dj jx xv vc co om;qqp qpl ple lez ezd zdj djx jxv xvc vco com om
dga;conficker;xpunnl;xpun.nl;x p u n n l;xp pu un nn nl;xpu pun unn nnl nl
dga;simda;tufuqypinfo;tufuqyp.info;t u f u q y p i n f o;tu uf fu uq qy yp pi in nf fo;tuf ufu fuq uqy qyp ypi pin inf nfo fo
dga;vawtrak;esergimlohwcom;esergimlohw.com;e s e r g i m l o h w c o m;es se er rg gi im ml lo oh hw wc co om;ese ser erg rgi gim iml mlo loh ohw hwc wco com om
dga;padcrypt;fdamcmbdnokecnofco;fdamcmbdnokecnof.co;f d a m c m b d n o k e c n o f c o;fd da am mc cm mb bd dn no ok ke ec cn no of fc co;fda dam amc mcm cmb mbd bdn dno nok oke kec ecn cno nof ofc fco co
dga;nymaim;workshop-parkre;workshop-park.re;w o r k s h o p - p a r k r e;wo or rk ks sh ho op p- -p pa ar rk kr re;wor ork rks ksh sho hop op- p-p -pa par ark rkr kre re
dga;rovnix;6l6zw6bcpt6yjdlsixru;6l6zw6bcpt6yjdlsix.ru;6 l 6 z w 6 b c p t 6 y j d l s i x r u;6l l6 6z zw w6 6b bc cp pt t6 6y yj jd dl ls si ix xr ru;6l6 l6z 6zw zw6 w6b 6bc bcp cpt pt6 t6y 6yj yjd jdl dls lsi six ixr xru ru
dga;ramdo;iukquekwwaequyegorg;iukquekwwaequyeg.org;i u k q u e k w w a e q u y e g o r g;iu uk kq qu ue ek kw ww wa ae eq qu uy ye eg go or rg;iuk ukq kqu que uek ekw kww wwa wae aeq equ quy uye yeg ego gor org rg
dga;matsnu;capitalhuntdealsmokeboxcluecom;capitalhuntdealsmokeboxclue.com;c a p i t a l h u n t d e a l s m o k e b o x c l u e c o m;ca ap pi it ta al lh hu un nt td de ea al ls sm mo ok ke eb bo ox xc cl lu ue ec co om;cap api pit ita tal alh lhu hun unt ntd tde dea eal als lsm smo mok oke keb ebo box oxc xcl clu lue uec eco com om
dga;symmi;oxreecwuohddnsnet;oxreecwuoh.ddns.net;o x r e e c w u o h d d n s n e t;ox xr re ee ec cw wu uo oh hd dd dn ns sn ne et;oxr xre ree eec ecw cwu wuo uoh ohd hdd ddn dns nsn sne net et
dga;tinba;dxhhsjmthbshinfo;dxhhsjmthbsh.info;d x h h s j m t h b s h i n f o;dx xh hh hs sj jm mt th hb bs sh hi in nf fo;dxh xhh hhs hsj sjm jmt mth thb hbs bsh shi hin inf nfo fo
